{
  "id": "CTR-ATLAS-COMPILER",
  "displayName": "Atlas Compiler",
  "contributorType": "system-agent",
  "roles": [
    "compiler",
    "integrity-validator"
  ],
  "status": "active",
  "authorityScope": [
    "deterministic-generation",
    "schema-validation",
    "hash-verification"
  ],
  "createdAt": "2026-07-24",
  "version": "1.0",
  "generatedFrom": {
    "path": "editorial-inbox/contributors/CTR-ATLAS-COMPILER.json",
    "sha256": "f97b5a13d8241e812a25c08f057f7b31d4aa4546c3ceb3103959257db18bbe50",
    "compilerVersion": "1.2.0"
  }
}
